{
  "$schema": "../review.schema.json",
  "slug": "duke-of-burgundy",
  "title": "The Duke of Burgundy",
  "dek": "A film about a relationship conducted as unpaid labour, which announces itself in the credits by hiring a perfume that does not exist.",
  "rating": 5,
  "byline": "Angelo Sanchez Dela Cruz",
  "publishedAt": null,
  "updatedAt": null,

  "film": {
    "director": "Peter Strickland",
    "year": 2014,
    "runtimeMinutes": 104,
    "costumeDesigner": "Andrea Flesch",
    "cinematographer": "Nic Knowland",
    "composer": "Cat's Eyes",
    "distributor": "Artificial Eye"
  },

  "body": [
    { "type": "image", "ref": "duke-of-burgundy-01" },
    { "type": "p", "text": "Before a frame of the film proper, Peter Strickland tells you exactly what kind of object you are about to watch. The opening titles run like a magazine masthead — Cinematography, Nic Knowland. Music, Cat's Eyes. Editing, Mátyás Fekete — and then two credits that do not belong on a call sheet:" },
    { "type": "pullquote", "text": "Dress and lingerie by Andrea Flesch.<br>Perfume by Je Suis Gizella." },
    { "type": "p", "text": "There is no perfume in <em>The Duke of Burgundy</em>. There cannot be. Film has never carried scent outside a handful of gimmicks, and nobody who has seen this film has smelled anything." },
    { "type": "p", "text": "It is the best joke in a very funny film, and it is also the thesis." },

    { "type": "h2", "text": "The film" },
    { "type": "p", "text": "Cynthia and Evelyn live together in a house full of butterflies, in a village apparently populated entirely by women, in no identifiable decade. Evelyn is the maid; Cynthia is the mistress who punishes her. Within twenty minutes you understand that Evelyn writes the scripts, sets the schedule, chooses the costumes, and hands Cynthia her lines on index cards — and that Cynthia, who would rather be reading in bed, performs them nightly out of love and is being slowly destroyed by the workload." },
    { "type": "p", "text": "That is the film. It is a domestic drama about a woman exhausted by a job she never applied for, staged as 1970s European erotica and played almost entirely straight." },
    { "type": "p", "text": "Sidse Babett Knudsen is extraordinary. The performance is built out of very small failures of enthusiasm — a beat too long before a line, a hand that doesn't quite commit — and the cumulative effect is one of the most precise portraits of resentment in recent cinema. Chiara D'Anna has the harder and less rewarded job, playing someone whose need is genuinely selfish and who cannot see it." },
    { "type": "p", "text": "Knowland shoots it in soft focus and heavy grain, and Cat's Eyes score it with a lushness that never once winks. Strickland's discipline here is the whole achievement: a film this close to pastiche that never becomes parody, because it takes its characters' feelings more seriously than its own references." },

    { "type": "h2", "text": "The clothes are the plot" },
    { "type": "p", "text": "Most films with a costume budget use clothes to establish character. This one uses them as narrative mechanism. The garments are the script — the specific skirt, the specific boots, the specific nightdress are <em>what has been requested</em>, in writing, for that evening's performance. When Cynthia appears in the wrong thing, or in something comfortable, that is the plot advancing. When she buys a pair of pyjamas, it is a declaration of war." },
    { "type": "p", "text": "Which is why splitting the credit into <em>dress and lingerie</em> rather than the standard \"costume design\" is not a flourish. In this film the outerwear and the underwear are doing different jobs against different briefs, exactly as a fashion house would treat them, with different ateliers. Andrea Flesch is credited twice because she did two things." },
    { "type": "p", "text": "And the perfume credit is the same move pushed to its limit." },
    { "type": "p", "text": "Laura U. Marks' <em>The Skin of the Film</em> (2000) has the useful term: <strong>haptic visuality</strong>, images that ask the eye to work like a sense of touch, lingering on surface and texture rather than resolving into depth. Marks' point is that such films are reaching for senses cinema does not have, and that the reaching is the aesthetic. <em>The Duke of Burgundy</em> is haptic to the point of obsession — gauze, fur, water, the macro shots of wings and fabric held far past their informational usefulness." },
    { "type": "p", "text": "So somebody was asked what this house smells of. Somebody answered. The credit records that the answer was authored, by a named party, even though the medium then failed to transmit a single molecule of it." },

    { "type": "h2", "text": "Against the academic reading" },
    { "type": "p", "text": "This has been written about seriously once, by Monika Lemke in the <em>International Journal of Baudrillard Studies</em> (13:2, July 2016), who reads the credit as implicating the viewer in simulacra and consumer culture — a sign with no referent, in Baudrillard's sense, collapsing the boundary between the film's fantasy and our own consumption." },
    { "type": "p", "text": "The Baudrillard fits the <em>form</em> and misses the target, in the way theory often does when it assumes every gesture is about the audience." },
    { "type": "p", "text": "The credit is not addressed to consumers. It appears among the heads of department, where a job is named and a person is paid. <em>Je Suis Gizella</em> is not a house; there is no product, no placement, no money changing hands. Strickland cites <em>Paris When It Sizzles</em> (1964), which credited Audrey Hepburn's perfume to Hubert de Givenchy — but Givenchy in 1964 was doing commerce, extending a wardrobe deal into a second product category on screen. Strickland has taken that commercial artefact and emptied the commerce out of it." },
    { "type": "p", "text": "And the film simply is not about consumption. It is about work — who performs, on whose instruction, and who gets named for it. The entire plot is a credit dispute." },
    { "type": "p", "text": "Costume is the most persistently undervalued craft in cinema: discussed as \"the frocks,\" awarded for period pastiche, missing from most reviews of films whose whole look it built. Part of the reason is that the credit is too small for the job. It names clothes. The work is not clothes." },
    { "type": "p", "text": "Strickland's titles propose the fix without arguing for it — split the credit until it matches what actually happened, and include the parts the medium cannot deliver, because they were designed anyway." },

    { "type": "h2", "text": "Five stars" },
    { "type": "p", "text": "104 minutes, no wasted frame, funny, upsetting, and the rare erotic film whose eroticism is structural rather than decorative. It sits at 94% on Rotten Tomatoes across 101 reviews and 87 on Metacritic; the A.V. Club had it fourth-best of 2015, IndieWire's critics third. That consensus is correct and, unusually, well-reasoned." },
    { "type": "p", "text": "Whether any liquid was ever produced by <em>Je Suis Gizella</em> is beside the point. A perfume was commissioned for a film that cannot be smelled, and it got a card to itself." },
    { "type": "p", "text": "That is more respect than most costume departments get for work you can actually see." }
  ],

  "images": [
    {
      "id": "duke-of-burgundy-01",
      "src": "public/THE-LEXICON-ASSETS/reviews/duke-of-burgundy-01.jpg",
      "alt": "Title card reading \"Perfume by Je Suis Gizella,\" from the opening credits",
      "caption": "The opening credits, crediting a perfume that does not exist.",
      "credit": "Peter Strickland, The Duke of Burgundy, 2014. Film4 Productions / Rook Films. Still reproduced for criticism and review.",
      "rights": "fair-dealing",
      "sourceUrl": null
    }
  ],

  "relatedEntries": [],
  "tags": {}
}
