{
  "$schema": "../review.schema.json",
  "slug": "lady-blue-shanghai",
  "title": "Lady Blue Shanghai",
  "dek": "The best advertisement ever made, and a minor Lynch film. Both things are true, and the second one is the advertisement's fault.",
  "rating": 3,
  "byline": "Angelo Sanchez Dela Cruz",
  "publishedAt": null,
  "updatedAt": null,

  "film": {
    "director": "David Lynch",
    "year": 2010,
    "runtimeMinutes": 16,
    "cinematographer": "Justyn Field",
    "composer": "David Lynch, Dean Hurley",
    "distributor": "Christian Dior S.A."
  },

  "body": [
    { "type": "p", "text": "Dior's brief to David Lynch in 2010 had three items on it. Show the handbag. Show the Oriental Pearl Tower. Show some old Shanghai." },
    { "type": "p", "text": "Sixteen minutes later: Marion Cotillard enters a hotel room and hears tango from the 1920s. A Dior bag materialises out of smoke. Security sweeps the room and finds nothing. She remembers — or invents — a meeting at the Pearl Tower with a man named Yu, who cannot stay, and who gives her a blue rose. She finds the same rose inside the handbag." },
    { "type": "p", "text": "Lynch wrote, directed and edited it. Justyn Field shot it. Lynch and Dean Hurley scored it. Sabrina S. Sutherland produced for Christian Dior S.A. It is a real film with a real crew, and for about eleven of its sixteen minutes it is extremely good." },
    { "type": "p", "text": "Then it has to sell you a bag, and the whole thing collapses in a way that is worth being precise about." },

    { "type": "h2", "text": "What works" },
    { "type": "p", "text": "The opening is Lynch operating at full strength on a budget he never had for the features. The hotel corridor sequence has the specific quality his best work has — the sense that a perfectly ordinary space is running at the wrong speed, and that the wrongness is coming from somewhere just outside the frame. Cotillard is very good, better than she was in either of her previous Dior appearances, because Lynch does the thing he always does with actresses and asks her to play someone who is not sure whether she is remembering or inventing." },
    { "type": "p", "text": "The sound design carries it. Hurley and Lynch build the room out of low-frequency hum and that tango, and the tango is doing the same work the songs do in <em>Mulholland Drive</em>: it arrives from nowhere, it is too emotionally specific for the scene it is in, and it makes you distrust the image." },
    { "type": "p", "text": "And the central object is a genuinely good idea. The blue rose recurs across Lynch's work as the marker of a case that cannot be solved by ordinary means. Putting one inside a Dior handbag is an argument: this bag is a container for something that isn't there. Which is, accurately, what a luxury object is. Walter Benjamin's point about mass reproduction stripping an object of its aura is the whole commercial problem the luxury industry exists to solve, and hiring Lynch to solve it makes complete sense — his entire aesthetic is objects that seem to hold a secret. He is, structurally, an aura machine." },
    { "type": "p", "text": "So the film has a real thesis about the thing it is advertising, which almost no advertisement does." },

    { "type": "h2", "text": "What doesn't" },
    { "type": "p", "text": "The thesis is inert, because the client experienced it as flattery." },
    { "type": "p", "text": "This is the specific failure and it is not a moral one. A criticism that the target receives as a compliment has not landed; it has been absorbed. Dior did not commission a sixteen-minute meditation on the emptiness of luxury goods and then run it anyway out of bravery. Dior commissioned atmosphere, got atmosphere, and the argument travelled along inside it undetected, like a stowaway who never gets off the boat." },
    { "type": "p", "text": "You can see Lynch noticing this. The last four minutes are the weakest — the film has to return to the bag, in close-up, lit, and it does so with a visible loss of interest. The rose-in-the-bag reveal, which should be the sting, plays as product photography. He has made the object mysterious for eleven minutes and then has to hand it over intact." },
    { "type": "p", "text": "Compare the earlier work and the decline is obvious. Lynch made nine fashion campaigns over twenty-two years: Calvin Klein's Obsession in 1988 (four black-and-white shorts built on Hemingway, Lawrence, Flaubert and Fitzgerald, with an unknown Heather Graham and an unknown Benicio Del Toro), Armani and Saint Laurent in 1992, Lancôme and Jil Sander in 1993, Lagerfeld in 1994, Dior's Fahrenheit in 2004, Gucci in 2008. The Jil Sander film — desert, black panther, techniques he reused in <em>Lost Highway</em> four years later — is better than this. Obsession is much better than this." },
    { "type": "p", "text": "The pattern is the money. The cheap early ones had to think; the expensive late ones only had to look. Gucci by Gucci (2008) is the nadir, three supermodels under falling glitter with no idea in it at all — Lynch performing Lynch, style detached from the thinking that produced it. <em>Lady Blue Shanghai</em> is a recovery from that, but it is a recovery within a form that had already beaten him." },

    { "type": "h2", "text": "The rating explained" },
    { "type": "p", "text": "Three stars is not a shrug. It is: eleven minutes of first-rate Lynch, five minutes of contractual obligation, and a structural problem the film cannot solve because the film is owned by the thing it wants to be sceptical about." },
    { "type": "p", "text": "If you saw the first eleven minutes on their own you would call it a lost Lynch short and want it restored." },
    { "type": "p", "text": "Which brings up the only genuinely annoying thing about writing this review, and it applies to the whole sequence." },
    { "type": "p", "text": "You cannot watch these properly. The features are archived, restored and distributed; the campaigns are on YouTube in varying resolutions, varying cuts, uploaded by people with no relationship to the rights holders, often undated and occasionally misattributed. The four Obsession films are hard to see as a set at all. Film preservation doesn't claim them because they're advertising. Fashion heritage doesn't catalogue them as films because they're marketing — Dior, Gucci and Saint Laurent all run serious heritage operations, but a brand archive is organised around the brand, and keeps the campaign as company history rather than as a film findable by director, running time and crew." },
    { "type": "p", "text": "Lynch died on 16 January 2025, at 78. The obituaries all ran the commercials as a curiosity. Not one of them could link to a reliable source for the work it was describing." },
    { "type": "p", "text": "Dior asked for the handbag, the Pearl Tower and some old Shanghai. It got all three, plus an argument about the limits of what an object can hold. The brief was met exactly, and nobody kept the result anywhere you can find it." }
  ],

  "images": [],

  "relatedEntries": ["galliano-dior-ss00"],
  "tags": {}
}
